VALID NAICS,NAICS Title,SubCategory,Heat,Cool,WH,Cook,Misc.,Proc.,Total
424420,Packaged Frozen Food Merchant Wholesalers,Refrigerated Warehouse,0.145454546,0,0.145454546,0.218181818,0,0.490909091,1
424430,Dairy Product (except Dried or Canned) Merchant Wholesalers,Refrigerated Warehouse,0.145454546,0,0.145454546,0.218181818,0,0.490909091,1
424440,Poultry and Poultry Product Merchant Wholesalers,Refrigerated Warehouse,0.145454546,0,0.145454546,0.218181818,0,0.490909091,1
424460,Fish and Seafood Merchant Wholesalers,Refrigerated Warehouse,0.145454546,0,0.145454546,0.218181818,0,0.490909091,1
424470,Meat and Meat Product Merchant Wholesalers,Refrigerated Warehouse,0.145454546,0,0.145454546,0.218181818,0,0.490909091,1
424930,"Flower, Nursery Stock, and Florists' Supplies Merchant Wholesalers",Refrigerated Warehouse,0.145454546,0,0.145454546,0.218181818,0,0.490909091,1
493120,Refrigerated Warehousing and Storage,Refrigerated Warehouse,0.145454546,0,0.145454546,0.218181818,0,0.490909091,1