VALID NAICS,NAICS Title,SubCategory,Heat,Cool,WH,Cook,Misc.,Proc.,Total
423,"Merchant Wholesalers, Durable Goods",Warehouse,0.87,0.00,0.11,0.01,0.01,0.01,1.0
4231,Motor Vehicle and Motor Vehicle Parts and Supplies Merchant Wholesalers,Warehouse,0.87,0.00,0.11,0.01,0.01,0.01,1.0
4231,Motor Vehicle and Motor Vehicle Parts and Supplies Merchant Wholesalers,Warehouse,0.87,0.00,0.11,0.01,0.01,0.01,1.0
423110,Automobile and Other Motor Vehicle Merchant Wholesalers,Warehouse,0.87,0.00,0.11,0.01,0.01,0.01,1.0
423120,Motor Vehicle Supplies and New Parts Merchant Wholesalers,Warehouse,0.87,0.00,0.11,0.01,0.01,0.01,1.0
423130,Tire and Tube Merchant Wholesalers,Warehouse,0.87,0.00,0.11,0.01,0.01,0.01,1.0
423140,Motor Vehicle Parts (Used) Merchant Wholesalers,Warehouse,0.87,0.00,0.11,0.01,0.01,0.01,1.0
4232,Furniture and Home Furnishing Merchant Wholesalers,Warehouse,0.87,0.00,0.11,0.01,0.01,0.01,1.0
4232,Furniture and Home Furnishing Merchant Wholesalers,Warehouse,0.87,0.00,0.11,0.01,0.01,0.01,1.0
423210,Furniture Merchant Wholesalers,Warehouse,0.87,0.00,0.11,0.01,0.01,0.01,1.0
423220,Home Furnishing Merchant Wholesalers,Warehouse,0.87,0.00,0.11,0.01,0.01,0.01,1.0
4233,Lumber and Other Construction Materials Merchant Wholesalers,Warehouse,0.87,0.00,0.11,0.01,0.01,0.01,1.0
4233,Lumber and Other Construction Materials Merchant Wholesalers,Warehouse,0.87,0.00,0.11,0.01,0.01,0.01,1.0
423310,"Lumber, Plywood, Millwork, and Wood Panel Merchant Wholesalers",Warehouse,0.87,0.00,0.11,0.01,0.01,0.01,1.0
423320,"Brick, Stone, and Related Construction Material Merchant Wholesalers",Warehouse,0.87,0.00,0.11,0.01,0.01,0.01,1.0
423330,"Roofing, Siding, and Insulation Material Merchant Wholesalers",Warehouse,0.87,0.00,0.11,0.01,0.01,0.01,1.0
423390,Other Construction Material Merchant Wholesalers,Warehouse,0.87,0.00,0.11,0.01,0.01,0.01,1.0
4234,Professional and Commercial Equipment and Supplies Merchant Wholesalers,Warehouse,0.87,0.00,0.11,0.01,0.01,0.01,1.0
4234,Professional and Commercial Equipment and Supplies Merchant Wholesalers,Warehouse,0.87,0.00,0.11,0.01,0.01,0.01,1.0
423410,Photographic Equipment and Supplies Merchant Wholesalers,Warehouse,0.87,0.00,0.11,0.01,0.01,0.01,1.0
423420,Office Equipment Merchant Wholesalers,Warehouse,0.87,0.00,0.11,0.01,0.01,0.01,1.0
423430,Computer and Computer Peripheral Equipment and Software Merchant Wholesalers,Warehouse,0.87,0.00,0.11,0.01,0.01,0.01,1.0
423440,Other Commercial Equipment Merchant Wholesalers,Warehouse,0.87,0.00,0.11,0.01,0.01,0.01,1.0
423450,"Medical, Dental, and Hospital Equipment and Supplies Merchant Wholesalers",Warehouse,0.87,0.00,0.11,0.01,0.01,0.01,1.0
423460,Ophthalmic Goods Merchant Wholesalers,Warehouse,0.87,0.00,0.11,0.01,0.01,0.01,1.0
423490,Other Professional Equipment and Supplies Merchant Wholesalers,Warehouse,0.87,0.00,0.11,0.01,0.01,0.01,1.0
4235,Metal and Mineral (except Petroleum) Merchant Wholesalers,Warehouse,0.87,0.00,0.11,0.01,0.01,0.01,1.0
423510,Metal Service Centers and Other Metal Merchant Wholesalers,Warehouse,0.87,0.00,0.11,0.01,0.01,0.01,1.0
423520,Coal and Other Mineral and Ore Merchant Wholesalers,Warehouse,0.87,0.00,0.11,0.01,0.01,0.01,1.0
4236,Household Appliances and Electrical and Electronic Goods Merchant Wholesalers,Warehouse,0.87,0.00,0.11,0.01,0.01,0.01,1.0
4236,Household Appliances and Electrical and Electronic Goods Merchant Wholesalers,Warehouse,0.87,0.00,0.11,0.01,0.01,0.01,1.0
423610,"Electrical Apparatus and Equipment, Wiring Supplies, and Related Equipment Merchant Wholesalers",Warehouse,0.87,0.00,0.11,0.01,0.01,0.01,1.0
423620,"Household Appliances, Electric Housewares, and Consumer Electronics Merchant Wholesalers",Warehouse,0.87,0.00,0.11,0.01,0.01,0.01,1.0
423690,Other Electronic Parts and Equipment Merchant Wholesalers,Warehouse,0.87,0.00,0.11,0.01,0.01,0.01,1.0
4237,"Hardware, and Plumbing and Heating Equipment and Supplies Merchant Wholesalers",Warehouse,0.87,0.00,0.11,0.01,0.01,0.01,1.0
4237,"Hardware, and Plumbing and Heating Equipment and Supplies Merchant Wholesalers",Warehouse,0.87,0.00,0.11,0.01,0.01,0.01,1.0
423710,Hardware Merchant Wholesalers,Warehouse,0.87,0.00,0.11,0.01,0.01,0.01,1.0
423720,Plumbing and Heating Equipment and Supplies (Hydronics) Merchant Wholesalers,Warehouse,0.87,0.00,0.11,0.01,0.01,0.01,1.0
423730,Warm Air Heating and Air-Conditioning Equipment and Supplies Merchant Wholesalers,Warehouse,0.87,0.00,0.11,0.01,0.01,0.01,1.0
423740,Refrigeration Equipment and Supplies Merchant Wholesalers,Warehouse,0.87,0.00,0.11,0.01,0.01,0.01,1.0
4238,"Machinery, Equipment, and Supplies Merchant Wholesalers",Warehouse,0.87,0.00,0.11,0.01,0.01,0.01,1.0
4238,"Machinery, Equipment, and Supplies Merchant Wholesalers",Warehouse,0.87,0.00,0.11,0.01,0.01,0.01,1.0
423810,Construction and Mining (except Oil Well) Machinery and Equipment Merchant Wholesalers,Warehouse,0.87,0.00,0.11,0.01,0.01,0.01,1.0
423820,Farm and Garden Machinery and Equipment Merchant Wholesalers,Warehouse,0.87,0.00,0.11,0.01,0.01,0.01,1.0
423830,Industrial Machinery and Equipment Merchant Wholesalers,Warehouse,0.87,0.00,0.11,0.01,0.01,0.01,1.0
423840,Industrial Supplies Merchant Wholesalers,Warehouse,0.87,0.00,0.11,0.01,0.01,0.01,1.0
423850,Service Establishment Equipment and Supplies Merchant Wholesalers,Warehouse,0.87,0.00,0.11,0.01,0.01,0.01,1.0
423860,Transportation Equipment and Supplies (except Motor Vehicle) Merchant Wholesalers,Warehouse,0.87,0.00,0.11,0.01,0.01,0.01,1.0
4239,Miscellaneous Durable Goods Merchant Wholesalers,Warehouse,0.87,0.00,0.11,0.01,0.01,0.01,1.0
4239,Miscellaneous Durable Goods Merchant Wholesalers,Warehouse,0.87,0.00,0.11,0.01,0.01,0.01,1.0
423910,Sporting and Recreational Goods and Supplies Merchant Wholesalers,Warehouse,0.87,0.00,0.11,0.01,0.01,0.01,1.0
423920,Toy and Hobby Goods and Supplies Merchant Wholesalers,Warehouse,0.87,0.00,0.11,0.01,0.01,0.01,1.0
423930,Recyclable Material Merchant Wholesalers,Warehouse,0.87,0.00,0.11,0.01,0.01,0.01,1.0
423940,"Jewelry, Watch, Precious Stone, and Precious Metal Merchant Wholesalers",Warehouse,0.87,0.00,0.11,0.01,0.01,0.01,1.0
423990,Other Miscellaneous Durable Goods Merchant Wholesalers,Warehouse,0.87,0.00,0.11,0.01,0.01,0.01,1.0
424,"Merchant Wholesalers, Nondurable Goods",Warehouse,0.87,0.00,0.11,0.01,0.01,0.01,1.0
4241,Paper and Paper Product Merchant Wholesalers,Warehouse,0.87,0.00,0.11,0.01,0.01,0.01,1.0
4241,Paper and Paper Product Merchant Wholesalers,Warehouse,0.87,0.00,0.11,0.01,0.01,0.01,1.0
424110,Printing and Writing Paper Merchant Wholesalers,Warehouse,0.87,0.00,0.11,0.01,0.01,0.01,1.0
424120,Stationery and Office Supplies Merchant Wholesalers,Warehouse,0.87,0.00,0.11,0.01,0.01,0.01,1.0
424130,Industrial and Personal Service Paper Merchant Wholesalers,Warehouse,0.87,0.00,0.11,0.01,0.01,0.01,1.0
4242,Drugs and Druggists' Sundries Merchant Wholesalers,Warehouse,0.87,0.00,0.11,0.01,0.01,0.01,1.0
4242,Drugs and Druggists' Sundries Merchant Wholesalers,Warehouse,0.87,0.00,0.11,0.01,0.01,0.01,1.0
424210,Drugs and Druggists' Sundries Merchant Wholesalers,Warehouse,0.87,0.00,0.11,0.01,0.01,0.01,1.0
4243,"Apparel, Piece Goods, and Notions Merchant Wholesalers",Warehouse,0.87,0.00,0.11,0.01,0.01,0.01,1.0
4243,"Apparel, Piece Goods, and Notions Merchant Wholesalers",Warehouse,0.87,0.00,0.11,0.01,0.01,0.01,1.0
424310,"Piece Goods, Notions, and Other Dry Goods Merchant Wholesalers",Warehouse,0.87,0.00,0.11,0.01,0.01,0.01,1.0
424320,Warehouse,Warehouse,0.87,0.00,0.11,0.01,0.01,0.01,1.0
424330,Warehouse,Warehouse,0.87,0.00,0.11,0.01,0.01,0.01,1.0
424340,Footwear Merchant Wholesalers,Warehouse,0.87,0.00,0.11,0.01,0.01,0.01,1.0
4244,Grocery and Related Product Merchant Wholesalers,Warehouse,0.87,0.00,0.11,0.01,0.01,0.01,1.0
4244,Grocery and Related Product Merchant Wholesalers,Warehouse,0.87,0.00,0.11,0.01,0.01,0.01,1.0
424410,General Line Grocery Merchant Wholesalers,Warehouse,0.87,0.00,0.11,0.01,0.01,0.01,1.0
424450,Confectionery Merchant Wholesalers,Warehouse,0.87,0.00,0.11,0.01,0.01,0.01,1.0
424480,Fresh Fruit and Vegetable Merchant Wholesalers,Warehouse,0.87,0.00,0.11,0.01,0.01,0.01,1.0
424490,Other Grocery and Related Products Merchant Wholesalers,Warehouse,0.87,0.00,0.11,0.01,0.01,0.01,1.0
4245,Farm Product Raw Material Merchant Wholesalers,Warehouse,0.87,0.00,0.11,0.01,0.01,0.01,1.0
4245,Farm Product Raw Material Merchant Wholesalers,Warehouse,0.87,0.00,0.11,0.01,0.01,0.01,1.0
424510,Grain and Field Bean Merchant Wholesalers,Warehouse,0.87,0.00,0.11,0.01,0.01,0.01,1.0
424520,Livestock Merchant Wholesalers,Warehouse,0.87,0.00,0.11,0.01,0.01,0.01,1.0
424590,Other Farm Product Raw Material Merchant Wholesalers,Warehouse,0.87,0.00,0.11,0.01,0.01,0.01,1.0
4246,Chemical and Allied Products Merchant Wholesalers,Warehouse,0.87,0.00,0.11,0.01,0.01,0.01,1.0
4246,Chemical and Allied Products Merchant Wholesalers,Warehouse,0.87,0.00,0.11,0.01,0.01,0.01,1.0
424610,Plastics Materials and Basic Forms and Shapes Merchant Wholesalers,Warehouse,0.87,0.00,0.11,0.01,0.01,0.01,1.0
424690,Other Chemical and Allied Products Merchant Wholesalers,Warehouse,0.87,0.00,0.11,0.01,0.01,0.01,1.0
4247,Petroleum and Petroleum Products Merchant Wholesalers,Warehouse,0.87,0.00,0.11,0.01,0.01,0.01,1.0
4247,Petroleum and Petroleum Products Merchant Wholesalers,Warehouse,0.87,0.00,0.11,0.01,0.01,0.01,1.0
424710,Petroleum Bulk Stations and Terminals,Warehouse,0.87,0.00,0.11,0.01,0.01,0.01,1.0
424720,Petroleum and Petroleum Products Merchant Wholesalers (except Bulk Stations and Terminals),Warehouse,0.87,0.00,0.11,0.01,0.01,0.01,1.0
4248,"Beer, Wine, and Distilled Alcoholic Beverage Merchant Wholesalers",Warehouse,0.87,0.00,0.11,0.01,0.01,0.01,1.0
4248,"Beer, Wine, and Distilled Alcoholic Beverage Merchant Wholesalers",Warehouse,0.87,0.00,0.11,0.01,0.01,0.01,1.0
424810,Beer and Ale Merchant Wholesalers,Warehouse,0.87,0.00,0.11,0.01,0.01,0.01,1.0
424820,Wine and Distilled Alcoholic Beverage Merchant Wholesalers,Warehouse,0.87,0.00,0.11,0.01,0.01,0.01,1.0
4249,Miscellaneous Nondurable Goods Merchant Wholesalers,Warehouse,0.87,0.00,0.11,0.01,0.01,0.01,1.0
4249,Miscellaneous Nondurable Goods Merchant Wholesalers,Warehouse,0.87,0.00,0.11,0.01,0.01,0.01,1.0
424910,Farm Supplies Merchant Wholesalers,Warehouse,0.87,0.00,0.11,0.01,0.01,0.01,1.0
424920,"Book, Periodical, and Newspaper Merchant Wholesalers",Warehouse,0.87,0.00,0.11,0.01,0.01,0.01,1.0
424940,Tobacco Product and Electronic Cigarette Merchant Wholesalers,Warehouse,0.87,0.00,0.11,0.01,0.01,0.01,1.0
424950,"Paint, Varnish, and Supplies Merchant Wholesalers",Warehouse,0.87,0.00,0.11,0.01,0.01,0.01,1.0
424990,Other Miscellaneous Nondurable Goods Merchant Wholesalers,Warehouse,0.87,0.00,0.11,0.01,0.01,0.01,1.0
425,Wholesale Trade Agents and Brokers,Warehouse,0.87,0.00,0.11,0.01,0.01,0.01,1.0
4251,Wholesale Trade Agents and Brokers,Warehouse,0.87,0.00,0.11,0.01,0.01,0.01,1.0
425110,Warehouse,Warehouse,0.87,0.00,0.11,0.01,0.01,0.01,1.0
425120,Wholesale Trade Agents and Brokers,Warehouse,0.87,0.00,0.11,0.01,0.01,0.01,1.0
444,Building Material and Garden Equipment and Supplies Dealers,Warehouse,0.87,0.00,0.11,0.01,0.01,0.01,1.0
444,Building Material and Garden Equipment and Supplies Dealers,Warehouse,0.87,0.00,0.11,0.01,0.01,0.01,1.0
4441,Building Material and Supplies Dealers,Warehouse,0.87,0.00,0.11,0.01,0.01,0.01,1.0
4441,Building Material and Supplies Dealers,Warehouse,0.87,0.00,0.11,0.01,0.01,0.01,1.0
444110,Home Centers,Warehouse,0.87,0.00,0.11,0.01,0.01,0.01,1.0
445,Food and Beverage Retailers,Warehouse,0.87,0.00,0.11,0.01,0.01,0.01,1.0
4451,Grocery and Convenience Retailers,Warehouse,0.87,0.00,0.11,0.01,0.01,0.01,1.0
4451,Grocery and Convenience Retailers,Warehouse,0.87,0.00,0.11,0.01,0.01,0.01,1.0
445110,Supermarkets and Other Grocery Retailers (except Convenience Retailers),Warehouse,0.87,0.00,0.11,0.01,0.01,0.01,1.0
48,Transporation and Warehousing,Warehouse,0.87,0.00,0.11,0.01,0.01,0.01,1.0
49,Transporation and Warehousing,Warehouse,0.87,0.00,0.11,0.01,0.01,0.01,1.0
493,Warehousing and Storage,Warehouse,0.87,0.00,0.11,0.01,0.01,0.01,1.0
4931,Warehousing and Storage,Warehouse,0.87,0.00,0.11,0.01,0.01,0.01,1.0
4931,Warehousing and Storage,Warehouse,0.87,0.00,0.11,0.01,0.01,0.01,1.0
493110,General Warehousing and Storage,Warehouse,0.87,0.00,0.11,0.01,0.01,0.01,1.0
493130,Farm Product Warehousing and Storage,Warehouse,0.87,0.00,0.11,0.01,0.01,0.01,1.0
493190,Other Warehousing and Storage,Warehouse,0.87,0.00,0.11,0.01,0.01,0.01,1.0